uid,title,abstract,year,venue,authors,doi,arxiv_id,url,source,query,query_role,family,advisor_seed,citation_count,matched_terms,retrieved_at,relevance_score,hostile_score
arxiv:2103.00410v2,Sim-to-Real Transfer for Robotic Manipulation with Tactile Sensory,"Reinforcement Learning (RL) methods have been widely applied for robotic manipulations via sim-to-real transfer, typically with proprioceptive and visual information. However, the incorporation of tactile sensing into RL for contact-rich tasks lacks investigation. In this paper, we model a tactile sensor in simulation and study the effects of its feedback in RL-based robotic control via a zero-shot sim-to-real approach with domain randomization. We demonstrate that learning and controlling with feedback from tactile sensor arrays at the gripper, both in simulation and reality, can enhance grasping stability, which leads to a significant improvement in robotic manipulation performance for a door opening task. In real-world experiments, the door open angle was increased by 45% on average for transferred policies with tactile sensing over those without it.",2021,arXiv,Zihan Ding; Ya-Yen Tsai; Wang Wei Lee; Bidan Huang,,2103.00410v2,http://arxiv.org/abs/2103.00410v2,arxiv,sim to real robot manipulation,concept,sim2real,,,robot manipulation; sim to real transfer; domain randomization,2026-06-12T14:45:03Z,26.400,28.400
doi:10.1109/lra.2022.3227873,Sim-to-Real Transfer for Visual Reinforcement Learning of Deformable Object Manipulation for Robot-Assisted Surgery,,2023,IEEE Robotics and Automation Letters,Paul Maria Scheikl; Eleonora Tagliabue; Balazs Gyenes; Martin Wagner; Diego Dall'Alba; Paolo Fiorini; Franziska Mathis-Ullrich,10.1109/lra.2022.3227873,,https://doi.org/10.1109/lra.2022.3227873,crossref,sim to real robot manipulation,concept,sim2real,,68,robot manipulation; deformable object manipulation; sim to real transfer,2026-06-12T14:45:03Z,27.317,28.317
doi:10.1109/humanoids57100.2023.10375183,Task-Level Control and Poincaré Map-Based Sim-to-Real Transfer for Effective Command Following of Quadrupedal Trot Gait,,2023,2023 IEEE-RAS 22nd International Conference on Humanoid Robots (Humanoids),Pranav A. Bhounsule; Daniel Torres; Ernesto Hernandez Hinojosa; Adel Alaeddini,10.1109/humanoids57100.2023.10375183,,https://doi.org/10.1109/humanoids57100.2023.10375183,crossref,sim to real robot manipulation,concept,sim2real,,,robot manipulation; sim to real transfer,2026-06-12T15:07:36Z,27.200,28.200
doi:10.1109/lra.2024.3398428,On the Role of the Action Space in Robot Manipulation Learning and Sim-to-Real Transfer,,2024,IEEE Robotics and Automation Letters,Elie Aljalbout; Felix Frank; Maximilian Karl; Patrick van der Smagt,10.1109/lra.2024.3398428,,https://doi.org/10.1109/lra.2024.3398428,crossref,sim to real robot manipulation,concept,sim2real,,19,robot manipulation; sim to real transfer,2026-06-12T14:45:03Z,26.898,27.898
doi:10.1109/sisy62279.2024.10737545,A Survey on Sim-to-Real Transfer Methods for Robotic Manipulation,,2024,2024 IEEE 22nd Jubilee International Symposium on Intelligent Systems and Informatics (SISY),Andrei Pitkevich; Ilya Makarov,10.1109/sisy62279.2024.10737545,,https://doi.org/10.1109/sisy62279.2024.10737545,crossref,sim to real robot manipulation,concept,sim2real,,11,robot manipulation; sim to real transfer,2026-06-12T14:45:03Z,26.642,27.642
doi:10.1115/detc2023-116959,Gaussian Process Regression for Sim-to-Real Transfer of Hopping Gaits,"Abstract Simulation-based controllers are relatively easy to build and evaluate, but rarely transfer seamlessly to hardware. This is because of the reality-gap which is the discrepancy between simulations and hardware. Narrowing the reality-gap can speed up the deployment of simulated controllers to hardware, also known as sim-to-real. This paper presents sim-to-real transfer of controllers on a single leg hopping robot, a system that cycles between under-actuation during the stance phase to no-actuation during flight phase. Using simulations, we design a controller to achieve speed and height regulation once-per-step, but the controller cannot achieve accurate control on hardware. Using data from hardware, we model the mis-match between simulation and hardware using Gaussian Process Regression (GPR), recompute the controller, and redeploy it in hardware. It takes about 4 iterations to a",2023,Volume 8: 47th Mechanisms and Robotics Conference (MR),Jeremy Krause; Adel Alaeddini; Pranav A. Bhounsule,10.1115/detc2023-116959,,https://doi.org/10.1115/detc2023-116959,crossref,sim to real robot manipulation,concept,sim2real,,1,robot manipulation; sim to real transfer; sample efficiency; deployment,2026-06-12T15:07:36Z,25.597,27.597
doi:10.3390/electronics12020411,Robot Manipulation Skills Transfer for Sim-to-Real in Unstructured Environments,"Robot force control that needs to be customized for the robot structure in unstructured environments with difficult-to-tune parameters guarantees robots’ compliance and safe human–robot interaction in an increasingly expanding work environment. Although reinforcement learning provides a new idea for the adaptive adjustment of these parameters, the policy often needs to be trained from scratch when used in new robotics, even in the same task. This paper proposes the episodic Natural Actor-Critic algorithm with action limits to improve robot admittance control and transfer motor skills between robots. The motion skills learned by simple simulated robots can be applied to complex real robots, reducing the difficulty of training and time consumption. The admittance control ensures the realizability and mobility of the robot’s compliance in all directions. At the same time, the reinforcement ",2023,Electronics,Zikang Yin; Chao Ye; Hao An; Weiyang Lin; Zhifeng Wang,10.3390/electronics12020411,,https://doi.org/10.3390/electronics12020411,crossref,sim to real robot manipulation,concept,sim2real,,3,robot manipulation; force control; human robot interaction,2026-06-12T14:45:03Z,26.593,27.593
doi:10.3390/app122010277,Sim–Real Mapping of an Image-Based Robot Arm Controller Using Deep Reinforcement Learning,"Models trained with Deep Reinforcement learning (DRL) have been deployed in various areas of robotics with varying degree of success. To overcome the limitations of data gathering in the real world, DRL training utilizes simulated environments and transfers the learned policy to real-world scenarios, i.e., sim–real transfer. Simulators fail to accurately capture the entire dynamics of the real world, so simulation-trained policies often fail when applied to reality, termed a reality gap (RG). In this paper, we propose a search (mapping) algorithm that takes in real-world observation (images) and maps them to the policy-equivalent images in the simulated environment using a convolution neural network (CNN) model. The two-step training process, DRL policy and a mapping model, overcomes the RG problem with simulated data only. We evaluated the proposed system with a gripping task of a custo",2022,Applied Sciences,Minoru Sasaki; Joseph Muguro; Fumiya Kitano; Waweru Njeri; Kojiro Matsushita,10.3390/app122010277,,https://doi.org/10.3390/app122010277,crossref,sim to real robot manipulation,concept,sim2real,,9,robot manipulation; limitation; generalization,2026-06-12T14:45:03Z,23.551,27.551
arxiv:2604.13645v1,A Mechanistic Analysis of Sim-and-Real Co-Training in Generative Robot Policies,"Co-training, which combines limited in-domain real-world data with abundant surrogate data such as simulation or cross-embodiment robot data, is widely used for training generative robot policies. Despite its empirical success, the mechanisms that determine when and why co-training is effective remain poorly understood. We investigate the mechanism of sim-and-real co-training through theoretical analysis and empirical study, and identify two intrinsic effects governing performance. The first, \textbf{``structured representation alignment""}, reflects a balance between cross-domain representation alignment and domain discernibility, and plays a primary role in downstream performance. The second, the \textbf{``importance reweighting effect""}, arises from domain-dependent modulation of action weighting and operates at a secondary level. We validate these effects with controlled experiments o",2026,arXiv,Yu Lei; Minghuan Liu; Abhiram Maddukuri; Zhenyu Jiang; Yuke Zhu,,2604.13645v1,http://arxiv.org/abs/2604.13645v1,arxiv,sim to real robot manipulation,concept,sim2real,,,robot manipulation,2026-06-12T14:45:03Z,25.550,27.550
doi:10.1109/iros45743.2020.9341370,KOVIS: Keypoint-based Visual Servoing with Zero-Shot Sim-to-Real Transfer for Robotics Manipulation,,2020,2020 IEEE/RSJ International Conference on Intelligent Robots and Systems (IROS),En Yen Puang; Keng Peng Tee; Wei Jing,10.1109/iros45743.2020.9341370,,https://doi.org/10.1109/iros45743.2020.9341370,crossref,sim to real robot manipulation,concept,sim2real,,46,robot manipulation; sim to real transfer; visual servoing,2026-06-12T14:45:03Z,26.525,27.525
doi:10.1109/lra.2021.3084880,Zero-Shot Sim-to-Real Transfer of Tactile Control Policies for Aggressive Swing-Up Manipulation,,2021,IEEE Robotics and Automation Letters,Thomas Bi; Carmelo Sferrazza; Raffaello D’Andrea,10.1109/lra.2021.3084880,,https://doi.org/10.1109/lra.2021.3084880,crossref,sim to real robot manipulation,concept,sim2real,,30,robot manipulation; sim to real transfer,2026-06-12T14:45:03Z,26.517,27.517
arxiv:2501.02902v1,Sim-to-Real Transfer for Mobile Robots with Reinforcement Learning: from NVIDIA Isaac Sim to Gazebo and Real ROS 2 Robots,"Unprecedented agility and dexterous manipulation have been demonstrated with controllers based on deep reinforcement learning (RL), with a significant impact on legged and humanoid robots. Modern tooling and simulation platforms, such as NVIDIA Isaac Sim, have been enabling such advances. This article focuses on demonstrating the applications of Isaac in local planning and obstacle avoidance as one of the most fundamental ways in which a mobile robot interacts with its environments. Although there is extensive research on proprioception-based RL policies, the article highlights less standardized and reproducible approaches to exteroception. At the same time, the article aims to provide a base framework for end-to-end local navigation policies and how a custom robot can be trained in such simulation environment. We benchmark end-to-end policies with the state-of-the-art Nav2, navigation s",2025,arXiv,Sahar Salimpour; Jorge Peña-Queralta; Diego Paez-Granados; Jukka Heikkonen; Tomi Westerlund,,2501.02902v1,http://arxiv.org/abs/2501.02902v1,arxiv,sim to real robot manipulation,concept,sim2real,,,robot manipulation; dexterous manipulation; humanoid robot; proprioception; sim to real transfer; benchmark; generalization; deployment,2026-06-12T14:45:03Z,23.500,27.500
doi:10.1109/lra.2023.3334971,In-Hand Object Classification and Pose Estimation With Sim-to-Real Tactile Transfer for Robotic Manipulation,,2024,IEEE Robotics and Automation Letters,Sanghoon Yang; Won Dong Kim; Hyunkyu Park; Seojung Min; Hyonyoung Han; Jung Kim,10.1109/lra.2023.3334971,,https://doi.org/10.1109/lra.2023.3334971,crossref,sim to real robot manipulation,concept,sim2real,,8,robot manipulation,2026-06-12T14:45:03Z,26.499,27.499
doi:10.3390/pr13092842,Deep Reinforcement Learning-Based Autonomous Docking with Multi-Sensor Perception in Sim-to-Real Transfer,"Autonomous docking is a critical capability for enabling fully automated operations in industrial and logistics environments using Autonomous Mobile Robots (AMRs). Traditional rule-based docking approaches often struggle with generalization and robustness in complex, dynamic scenarios. This paper presents a deep reinforcement learning-based autonomous docking framework that integrates Proximal Policy Optimization (PPO) with multi-sensor fusion. It includes YOLO-based vision detection, depth estimation, and LiDAR-based orientation correction. A concise 4D state vector, comprising relative position and angle indicators, is used to guide a continuous control policy. The outputs are linear and angular velocity commands for smooth and accurate docking. The training is conducted in a Gym-compatible Gazebo simulation, acting as a digital twin of the real-world system, and incorporates realistic",2025,Processes,Yanyan Dai; Kidong Lee,10.3390/pr13092842,,https://doi.org/10.3390/pr13092842,crossref,sim to real robot manipulation,concept,sim2real,,2,robot manipulation; sim to real transfer; generalization; robustness,2026-06-12T15:07:36Z,23.499,27.499
doi:10.1109/iros51168.2021.9636259,Sim-to-Real Transfer for Robotic Manipulation with Tactile Sensory,,2021,2021 IEEE/RSJ International Conference on Intelligent Robots and Systems (IROS),Zihan Ding; Ya-Yen Tsai; Wang Wei Lee; Bidan Huang,10.1109/iros51168.2021.9636259,,https://doi.org/10.1109/iros51168.2021.9636259,crossref,sim to real robot manipulation,concept,sim2real,,27,robot manipulation; sim to real transfer,2026-06-12T14:45:03Z,26.466,27.466
doi:10.1007/s00521-024-10543-1,Machine visual perception from sim-to-real transfer learning for autonomous docking maneuvers,"Abstract This paper presents a comprehensive approach to enhancing autonomous docking maneuvers through machine visual perception and sim-to-real transfer learning. By leveraging relative vectoring techniques, we aim to replicate the human ability to execute precise docking operations. Our study focuses on autonomous aerial refueling as a use case, demonstrating significant advancements in relative navigation and object detection. We introduce a novel method for aligning digital twins using fiducial targets and motion capture data, which facilitates accurate pose estimation from real-world imagery. Additionally, we develop cost-efficient annotation automation techniques for generating high-quality You Only Look Once training data. Experimental results indicate that our transfer learning methodologies enable accurate and reliable relative vectoring in real-world conditions, achieving erro",2025,Neural Computing and Applications,Derek Worth; Jeffrey Choate; Ryan Raettig; Scott Nykl; Clark Taylor,10.1007/s00521-024-10543-1,,https://doi.org/10.1007/s00521-024-10543-1,crossref,sim to real robot manipulation,concept,sim2real,,4,robot manipulation; sim to real transfer; generalization,2026-06-12T15:07:36Z,24.455,27.455
arxiv:2310.10509v1,Efficient Sim-to-real Transfer of Contact-Rich Manipulation Skills with Online Admittance Residual Learning,"Learning contact-rich manipulation skills is essential. Such skills require the robots to interact with the environment with feasible manipulation trajectories and suitable compliance control parameters to enable safe and stable contact. However, learning these skills is challenging due to data inefficiency in the real world and the sim-to-real gap in simulation. In this paper, we introduce a hybrid offline-online framework to learn robust manipulation skills. We employ model-free reinforcement learning for the offline phase to obtain the robot motion and compliance control parameters in simulation \RV{with domain randomization}. Subsequently, in the online phase, we learn the residual of the compliance control parameters to maximize robot performance-related criteria with force sensor measurements in real time. To demonstrate the effectiveness and robustness of our approach, we provide ",2023,arXiv,Xiang Zhang; Changhao Wang; Lingfeng Sun; Zheng Wu; Xinghao Zhu; Masayoshi Tomizuka,,2310.10509v1,http://arxiv.org/abs/2310.10509v1,arxiv,online adaptation robot learning,concept,adaptation,,,contact rich manipulation; sim to real transfer; domain randomization; online adaptation; robustness,2026-06-12T14:45:03Z,24.450,27.450
doi:10.1109/iros55552.2023.10341657,Pre-and Post-Contact Policy Decomposition for Non-Prehensile Manipulation with Zero-Shot Sim-To-Real Transfer,,2023,2023 IEEE/RSJ International Conference on Intelligent Robots and Systems (IROS),Minchan Kim; Junhyek Han; Jaehyung Kim; Beomjoon Kim,10.1109/iros55552.2023.10341657,,https://doi.org/10.1109/iros55552.2023.10341657,crossref,sim to real robot manipulation,concept,sim2real,,11,robot manipulation; sim to real transfer,2026-06-12T14:45:03Z,26.442,27.442
doi:10.3390/app10051555,Real–Sim–Real Transfer for Real-World Robot Control Policy Learning with Deep Reinforcement Learning,"Compared to traditional data-driven learning methods, recently developed deep reinforcement learning (DRL) approaches can be employed to train robot agents to obtain control policies with appealing performance. However, learning control policies for real-world robots through DRL is costly and cumbersome. A promising alternative is to train policies in simulated environments and transfer the learned policies to real-world scenarios. Unfortunately, due to the reality gap between simulated and real-world environments, the policies learned in simulated environments often cannot be generalized well to the real world. Bridging the reality gap is still a challenging problem. In this paper, we propose a novel real–sim–real (RSR) transfer method that includes a real-to-sim training phase and a sim-to-real inference phase. In the real-to-sim training phase, a task-relevant simulated environment is",2020,Applied Sciences,Naijun Liu; Yinghao Cai; Tao Lu; Rui Wang; Shuo Wang,10.3390/app10051555,,https://doi.org/10.3390/app10051555,crossref,sim to real robot manipulation,concept,sim2real,,27,robot manipulation; generalization,2026-06-12T14:45:03Z,24.316,27.316
doi:10.1017/s0263574724000092,One-shot sim-to-real transfer policy for robotic assembly via reinforcement learning with visual demonstration,"Abstract Reinforcement learning (RL) has been successfully applied to a wealth of robot manipulation tasks and continuous control problems. However, it is still limited to industrial applications and suffers from three major challenges: sample inefficiency, real data collection, and the gap between simulator and reality. In this paper, we focus on the practical application of RL for robot assembly in the real world. We apply enlightenment learning to improve the proximal policy optimization, an on-policy model-free actor-critic reinforcement learning algorithm, to train an agent in Cartesian space using the proprioceptive information. We introduce enlightenment learning incorporated via pretraining, which is beneficial to reduce the cost of policy training and improve the effectiveness of the policy. A human-like assembly trajectory is generated through a two-step method with segmenting ",2024,Robotica,Ruihong Xiao; Chenguang Yang; Yiming Jiang; Hui Zhang,10.1017/s0263574724000092,,https://doi.org/10.1017/s0263574724000092,crossref,sim to real robot manipulation,concept,sim2real,,10,robot manipulation; sim to real transfer; benchmark,2026-06-12T15:07:36Z,24.299,27.299
arxiv:2603.04531v2,PTLD: Sim-to-real Privileged Tactile Latent Distillation for Dexterous Manipulation,"Tactile dexterous manipulation is essential to automating complex household tasks, yet learning effective control policies remains a challenge. While recent work has relied on imitation learning, obtaining high quality demonstrations for multi-fingered hands via robot teleoperation or kinesthetic teaching is prohibitive. Alternatively, with reinforcement we can learn skills in simulation, but fast and realistic simulation of tactile observations is challenging. To bridge this gap, we introduce PTLD: sim-to-real Privileged Tactile Latent Distillation, a novel approach to learning tactile manipulation skills without requiring tactile simulation. Instead of simulating tactile sensors or relying purely on proprioceptive policies to transfer zero-shot sim-to-real, our key idea is to leverage privileged sensors in the real world to collect real-world tactile policy data. This data is then used",2026,arXiv,Rosy Chen; Mustafa Mukadam; Michael Kaess; Tingfan Wu; Francois R Hogan; Jitendra Malik; Akash Sharma,,2603.04531v2,http://arxiv.org/abs/2603.04531v2,arxiv,sim to real robot manipulation,concept,sim2real,,,robot manipulation; dexterous manipulation; proprioception; imitation learning; teleoperation; benchmark,2026-06-12T14:45:03Z,24.200,27.200
arxiv:2508.11117v1,Robot Policy Evaluation for Sim-to-Real Transfer: A Benchmarking Perspective,"Current vision-based robotics simulation benchmarks have significantly advanced robotic manipulation research. However, robotics is fundamentally a real-world problem, and evaluation for real-world applications has lagged behind in evaluating generalist policies. In this paper, we discuss challenges and desiderata in designing benchmarks for generalist robotic manipulation policies for the goal of sim-to-real policy transfer. We propose 1) utilizing high visual-fidelity simulation for improved sim-to-real transfer, 2) evaluating policies by systematically increasing task complexity and scenario perturbation to assess robustness, and 3) quantifying performance alignment between real-world performance and its simulation counterparts.",2025,arXiv,Xuning Yang; Clemens Eppner; Jonathan Tremblay; Dieter Fox; Stan Birchfield; Fabio Ramos,,2508.11117v1,http://arxiv.org/abs/2508.11117v1,arxiv,energy based transformer robot policy,concept,ebm_transformer,,,energy based transformer robot policy; sim to real transfer; benchmark; robustness,2026-06-12T14:45:03Z,22.200,27.200
doi:10.1109/iros55552.2023.10342471,Robust Visual Sim-to-Real Transfer for Robotic Manipulation,,2023,2023 IEEE/RSJ International Conference on Intelligent Robots and Systems (IROS),Ricardo Garcia; Robin Strudel; Shizhe Chen; Etienne Arlaud; Ivan Laptev; Cordelia Schmid,10.1109/iros55552.2023.10342471,,https://doi.org/10.1109/iros55552.2023.10342471,crossref,sim to real robot manipulation,concept,sim2real,,6,robot manipulation; sim to real transfer,2026-06-12T14:45:03Z,26.173,27.173
doi:10.36244/icj.2023.1.3,Enhancing Visual Domain Randomization with Real Images for Sim-to-Real Transfer,"In order to train reinforcement learning algorithms, a significant amount of experience is required, so it is common practice to train them in simulation, even when they are intended to be applied in the real world. To improve robustness, camerabased agents can be trained using visual domain randomization, which involves changing the visual characteristics of the simulator between training episodes in order to improve their resilience to visual changes in their environment. In this work, we propose a method, which includes realworld images alongside visual domain randomization in the reinforcement learning training procedure to further enhance the performance after sim-to-real transfer. We train variational autoencoders using both real and simulated frames, and the representations produced by the encoders are then used to train reinforcement learning agents. The proposed method is evalua",2023,Infocommunications journal,András Béres; Bálint Gyires-Tóth,10.36244/icj.2023.1.3,,https://doi.org/10.36244/icj.2023.1.3,crossref,sim to real robot manipulation,concept,sim2real,,4,robot manipulation; sim to real transfer; domain randomization; robustness,2026-06-12T14:45:03Z,24.055,27.055
doi:10.15607/rss.2024.xx.094,DrEureka: Language Model Guided Sim-To-Real Transfer,,2024,Robotics: Science and Systems XX,Yecheng Ma; William Liang; Hung-Ju Wang; Yuke Zhu; Linxi Fan; Osbert Bastani; Dinesh Jayaraman,10.15607/rss.2024.xx.094,,https://doi.org/10.15607/rss.2024.xx.094,crossref,vision language action model limitation robotics,hostile,failure,,24,vision language action model; sim to real transfer; limitation,2026-06-12T15:07:36Z,21.009,27.009
doi:10.21203/rs.3.rs-6619931/v1,ADR-PNAS: a Novel Sim-to-Real Transfer Approach for Robotic Manipulation Tasks,"Abstract Sim-to-real transfer in robotic manipulation tasks has emerged as a crucial area of research, addressing the challenge of bridging the gap between simulated environments and real-world applications. This paper presents a comprehensive review of current methodologies and introduces novel approaches to enhance the efficacy of sim-to-real transfer. We propose a new framework, Adaptive Domain Randomization with Progressive Neural Architecture Search (ADR-PNAS), which combines adaptive domain randomization techniques with neural architecture search to optimize both the simulation parameters and the neural network architecture for improved transfer. Our experiments on a diverse set of manipulation tasks demonstrate significant improvements in transfer performance, with up to 35\% reduction in reality gap compared to state-of-the-art methods. Furthermore, we introduce a novel metric, t",,,Yu Nong,10.21203/rs.3.rs-6619931/v1,,https://doi.org/10.21203/rs.3.rs-6619931/v1,crossref,sim to real robot manipulation,concept,sim2real,,,robot manipulation; sim to real transfer; domain randomization,2026-06-12T14:45:03Z,25.000,27.000
