uid,title,abstract,year,venue,authors,doi,arxiv_id,url,source,query,query_role,family,advisor_seed,citation_count,matched_terms,retrieved_at,relevance_score,hostile_score
arxiv:2307.15320v1,Robust Visual Sim-to-Real Transfer for Robotic Manipulation,"Learning visuomotor policies in simulation is much safer and cheaper than in the real world. However, due to discrepancies between the simulated and real data, simulator-trained policies often fail when transferred to real robots. One common approach to bridge the visual sim-to-real domain gap is domain randomization (DR). While previous work mainly evaluates DR for disembodied tasks, such as pose estimation and object detection, here we systematically explore visual domain randomization methods and benchmark them on a rich set of challenging robotic manipulation tasks. In particular, we propose an off-line proxy task of cube localization to select DR parameters for texture randomization, lighting randomization, variations of object colors and camera parameters. Notably, we demonstrate that DR parameters have similar impact on our off-line proxy task and on-line policies. We, hence, use ",2023,arXiv,Ricardo Garcia; Robin Strudel; Shizhe Chen; Etienne Arlaud; Ivan Laptev; Cordelia Schmid,,2307.15320v1,http://arxiv.org/abs/2307.15320v1,arxiv,sim to real robot manipulation,concept,sim2real,,,robot manipulation; sim to real transfer; domain randomization; benchmark; robustness,2026-06-12T14:45:03Z,28.800,32.800
arxiv:2509.23075v3,In-Hand Manipulation of Articulated Tools with Dexterous Robot Hands with Sim-to-Real Transfer,"Reinforcement learning (RL) and sim-to-real transfer have advanced rigid-object manipulation. However, policies remain brittle for articulated mechanisms due to contact-rich dynamics that require both stable grasping and simultaneous free in-hand articulation. Furthermore, articulated objects and robot hands exhibit under-modeled joint phenomena such as friction, stiction, and backlash in real life that can increase the sim-to-real gap, and robot hands still fall short of idealized tactile sensing, both in terms of coverage, sensitivity, and specificity. In this paper, we present an original approach to learning dexterous in-hand manipulation of articulated tools that has reduced articulation and kinematic redundancy relative to the human hand. Our approach augments a simulation-trained base policy with a sensor-driven refinement learned from hardware demonstrations. This refinement cond",2025,arXiv,Soofiyan Atar; Daniel Huang; Florian Richter; Michael Yip,,2509.23075v3,http://arxiv.org/abs/2509.23075v3,arxiv,sim to real robot manipulation,concept,sim2real,,,robot manipulation; robot hand; proprioception; sim to real transfer; generalization,2026-06-12T14:45:03Z,29.550,31.550
arxiv:2307.06423v1,Bi-Touch: Bimanual Tactile Manipulation with Sim-to-Real Deep Reinforcement Learning,"Bimanual manipulation with tactile feedback will be key to human-level robot dexterity. However, this topic is less explored than single-arm settings, partly due to the availability of suitable hardware along with the complexity of designing effective controllers for tasks with relatively large state-action spaces. Here we introduce a dual-arm tactile robotic system (Bi-Touch) based on the Tactile Gym 2.0 setup that integrates two affordable industrial-level robot arms with low-cost high-resolution tactile sensors (TacTips). We present a suite of bimanual manipulation tasks tailored towards tactile feedback: bi-pushing, bi-reorienting and bi-gathering. To learn effective policies, we introduce appropriate reward functions for these tasks and propose a novel goal-update mechanism with deep reinforcement learning. We also apply these policies to real-world settings with a tactile sim-to-re",2023,arXiv,Yijiong Lin; Alex Church; Max Yang; Haoran Li; John Lloyd; Dandan Zhang; Nathan F. Lepora,,2307.06423v1,http://arxiv.org/abs/2307.06423v1,arxiv,sim to real robot manipulation,concept,sim2real,,,robot manipulation; bimanual manipulation; robustness,2026-06-12T14:45:03Z,28.500,31.500
doi:10.1017/s0263574722001230,Zero-shot sim-to-real transfer of reinforcement learning framework for robotics manipulation with demonstration and force feedback,"Abstract In the field of robot reinforcement learning (RL), the reality gap has always been a problem that restricts the robustness and generalization of algorithms. We propose Simulation Twin (SimTwin) : a deep RL framework that can help directly transfer the model from simulation to reality without any real-world training. SimTwin consists of a RL module and an adaptive correct module. We train the policy using the soft actor-critic algorithm only in a simulator with demonstration and domain randomization. In the adaptive correct module, we design and train a neural network to simulate the human error correction process using force feedback. Subsequently, we combine the above two modules through digital twin to control real-world robots, correct simulator parameters by comparing the difference between simulator and reality automatically, and then generalize the correct action through t",2023,Robotica,Yuanpei Chen; Chao Zeng; Zhiping Wang; Peng Lu; Chenguang Yang,10.1017/s0263574722001230,,https://doi.org/10.1017/s0263574722001230,crossref,sim to real robot manipulation,concept,sim2real,,10,robot manipulation; sim to real transfer; domain randomization; generalization; robustness,2026-06-12T14:45:03Z,27.099,31.099
doi:10.20944/preprints202605.1763.v1,SymBridge: Bilateral-Symmetry-Aware Vision–Language–Action Learning with Head-Mounted Display Teleoperation for Sim2Real Transfer in Bimanual Manipulation,"Vision–Language–Action (VLA) models trained on embodied demonstration data exhibit substantial performance degradation when transferred from simulation to reality. We argue that part of this gap is attributable to the implicit and incomplete encoding of geometric and bilateral symmetries in manipulation. We introduce SymBridge, a symmetry-aware framework whose acting group is the semidirect product G=Z2⋉R3⋊SO(2)z, in which the bilateral generator σ acts on the workspace subgroup by outer automorphism; cross-modal alignment is treated as a soft regulariser rather than as a subgroup. The framework couples a head-mounted display (HMD) teleoperation system based on the Meta Quest 3 and dual Franka Panda arms with a decoder-level Z2-equivariant action head (full-policy bilateral equivariance is empirically achieved through Lsym, not architecturally guaranteed), an augmentation-based soft equi",,,Zijian Zeng; Nikos Mastorakis,10.20944/preprints202605.1763.v1,,https://doi.org/10.20944/preprints202605.1763.v1,crossref,vision language action model limitation robotics,hostile,failure,,,vision language action model; bimanual manipulation; teleoperation; limitation; ablation,2026-06-12T14:45:03Z,25.000,31.000
arxiv:2601.18629v1,ExoGS: A 4D Real-to-Sim-to-Real Framework for Scalable Manipulation Data Collection,"Real-to-Sim-to-Real technique is gaining increasing interest for robotic manipulation, as it can generate scalable data in simulation while having narrower sim-to-real gap. However, previous methods mainly focused on environment-level visual real-to-sim transfer, ignoring the transfer of interactions, which could be challenging and inefficient to obtain purely in simulation especially for contact-rich tasks. We propose ExoGS, a robot-free 4D Real-to-Sim-to-Real framework that captures both static environments and dynamic interactions in the real world and transfers them seamlessly to a simulated environment. It provides a new solution for scalable manipulation data collection and policy learning. ExoGS employs a self-designed robot-isomorphic passive exoskeleton AirExo-3 to capture kinematically consistent trajectories with millimeter-level accuracy and synchronized RGB observations duri",2026,arXiv,Yiming Wang; Ruogu Zhang; Minyang Li; Hao Shi; Junbo Wang; Deyi Li; Jieji Ren; Wenhai Liu; Weiming Wang; Hao-Shu Fang,,2601.18629v1,http://arxiv.org/abs/2601.18629v1,arxiv,sim to real robot manipulation,concept,sim2real,,,robot manipulation; human demonstration; teleoperation; generalization; robustness; data efficiency,2026-06-12T14:45:03Z,26.550,30.550
doi:10.1109/cvpr52734.2025.01610,Sim-to-Real Causal Transfer: A Metric Learning Approach to Causally-Aware Interaction Representations,,2025,2025 IEEE/CVF Conference on Computer Vision and Pattern Recognition (CVPR),Ahmad Rahimi; Po-Chien Luan; Yuejiang Liu; Frano Rajic; Alexandre Alahi,10.1109/cvpr52734.2025.01610,,https://doi.org/10.1109/cvpr52734.2025.01610,crossref,sim to real robot manipulation,concept,sim2real,,4,robot manipulation,2026-06-12T15:07:36Z,28.405,30.405
arxiv:2509.22407v2,EMMA: Generalizing Real-World Robot Manipulation via Generative Visual Transfer,"The generalization of vision-language-action (VLA) models heavily relies on diverse training data. However, acquiring large-scale data for robot manipulation across varied object appearances is costly and labor-intensive. To address this limitation, we introduce Embodied Manipulation Media Adaptation (EMMA), a framework for augmenting VLA policies that combines a generative data engine with an effective training pipeline. We introduce DreamTransfer, a diffusion Transformer-based architecture for generating multi-view consistent and geometrically grounded embodied manipulation videos. DreamTransfer enables visual editing of robot videos through prompts, allowing for changes to the foreground, background, and lighting while preserving their 3D structure and geometric validity. We also utilize a hybrid training set of real and generated data and propose AdaMix to enhance the training proces",2025,arXiv,Zhehao Dong; Xiaofeng Wang; Zheng Zhu; Yirui Wang; Yang Wang; Yukun Zhou; Boyuan Wang; Chaojun Ni; Runqi Ouyang; Wenkang Qin; Xinze Chen; Yun Ye; Guan Huang; Zhen Lu; Yue Yang,,2509.22407v2,http://arxiv.org/abs/2509.22407v2,arxiv,sim to real robot manipulation,concept,sim2real,,,robot manipulation; limitation; generalization,2026-06-12T14:45:03Z,25.850,29.850
arxiv:2512.19562v1,REALM: A Real-to-Sim Validated Benchmark for Generalization in Robotic Manipulation,"Vision-Language-Action (VLA) models empower robots to understand and execute tasks described by natural language instructions. However, a key challenge lies in their ability to generalize beyond the specific environments and conditions they were trained on, which is presently difficult and expensive to evaluate in the real-world. To address this gap, we present REALM, a new simulation environment and benchmark designed to evaluate the generalization capabilities of VLA models, with a specific emphasis on establishing a strong correlation between simulated and real-world performance through high-fidelity visuals and aligned robot control. Our environment offers a suite of 15 perturbation factors, 7 manipulation skills, and more than 3,500 objects. Finally, we establish two task sets that form our benchmark and evaluate the π_{0}, π_{0}-FAST, and GR00T N1.5 VLA models, showing that general",2025,arXiv,Martin Sedlacek; Pavlo Yefanov; Georgy Ponimatkin; Jai Bardhan; Simon Pilc; Mederic Fourmy; Evangelos Kazakos; Cees G. M. Snoek; Josef Sivic; Vladimir Petrik,,2512.19562v1,http://arxiv.org/abs/2512.19562v1,arxiv,sim to real robot manipulation,concept,sim2real,,,robot manipulation; failure mode; benchmark; generalization; robustness,2026-06-12T14:45:03Z,23.850,29.850
doi:10.54660/.ijfmr.2024.5.1.33-39,Sim-to-Real Transfer in Robotics: Addressing the Gap between Simulation and Real-World Performance,"Sim-to-real transfer in robotics remains a significant challenge due to the inherent differences between simulated environments and real-world conditions, often leading to performance degradation when models are deployed in practical applications. This paper reviews the current state of sim-to-real transfer, exploring the key challenges such as sensor noise, domain shifts, and modeling inaccuracies contributing to this performance gap. The paper also examines existing techniques, including domain adaptation, reinforcement learning, and hybrid approaches, and discusses their limitations. To address these issues, we propose a novel framework that emphasizes the development of more realistic simulation environments and the integrating of adaptive learning strategies for continuous model refinement during real-world deployment. This framework aims to improve the robustness and adaptability o",2024,Journal of Frontiers in Multidisciplinary Research,Naomi Chukwurah; Abiodun Sunday Adebayo; Olanrewaju Oluwaseun Ajayi,10.54660/.ijfmr.2024.5.1.33-39,,https://doi.org/10.54660/.ijfmr.2024.5.1.33-39,crossref,sim to real robot manipulation,concept,sim2real,,10,robot manipulation; sim to real transfer; limitation; robustness; deployment,2026-06-12T15:07:36Z,24.649,29.649
doi:10.1109/iros40897.2019.8967695,Sim-to-(Multi)-Real: Transfer of Low-Level Robust Control Policies to Multiple Quadrotors,,2019,2019 IEEE/RSJ International Conference on Intelligent Robots and Systems (IROS),Artem Molchanov; Tao Chen; Wolfgang Hönig; James A. Preiss; Nora Ayanian; Gaurav S. Sukhatme,10.1109/iros40897.2019.8967695,,https://doi.org/10.1109/iros40897.2019.8967695,crossref,sim to real robot manipulation,concept,sim2real,,87,robot manipulation,2026-06-12T15:07:36Z,28.639,29.639
doi:10.1007/s10489-022-04148-1,Sim-to-real transfer and reality gap modeling in model predictive control for autonomous driving,"Abstract The main challenge for the adoption of autonomous driving is to ensure an adequate level of safety. Considering the almost infinite variability of possible scenarios that autonomous vehicles would have to face, the use of autonomous driving simulators is becoming of utmost importance. Simulation suites allow the used of automated validation techniques in a wide variety of scenarios, and enable the development of closed-loop validation methods, such as machine learning and reinforcement learning approaches. However, simulation tools suffer from a standing flaw in that there is a noticeable gap between the simulation conditions and real-world scenarios. Although the use of simulators powers most of the research around autonomous driving, and is generally used within all domains it is divided into, there is an inherent source of error given the stochastic nature of activities perfo",2023,Applied Intelligence,Iván García Daza; Rubén Izquierdo; Luis Miguel Martínez; Ola Benderius; David Fernández Llorca,10.1007/s10489-022-04148-1,,https://doi.org/10.1007/s10489-022-04148-1,crossref,sim to real robot manipulation,concept,sim2real,,30,robot manipulation; sim to real transfer; model predictive control,2026-06-12T15:07:36Z,26.617,29.617
doi:10.2139/ssrn.6231940,RSAKD: Decoupling Energy and Comfort for Rapid Sim-to-Real Transfer in HVAC Control,"Reinforcement learning shows promise for Heating, Ventilation, and Air Conditioning (HVAC)optimization, but the sim-to-real gap caused by Domain Distribution Shifts (DDS) severely degrades performance when simulation-trained policies are deployed in real buildings. We propose Reward Shaping and Adaptive Knowledge Distillation (RSAKD), a transfer learning approach that enables rapid cross-domain adaptation through three key mechanisms: reward shaping for semantic alignment, adaptive knowledge distillation for selective transfer, and gradient projection for multi-objective optimization. Our Dual-Head Dueling DQN (DHDD) architecture decouples con_icting energy-comfort objectives while preserving transferable knowledge. Experiments show RSAKD reduces training time by 65.9% versus training from scratch, achieving 0.67% energy improvement and 21.86% comfort enhancement over rule-based control.",,,Yizhen Bao,10.2139/ssrn.6231940,,https://doi.org/10.2139/ssrn.6231940,crossref,sim to real robot manipulation,concept,sim2real,,,robot manipulation; sim to real transfer; distribution shift; ablation; deployment,2026-06-12T14:45:03Z,26.350,29.350
doi:10.1088/1757-899x/1343/1/012015,In-Situ Learning in Drones: Rethinking Embodied Intelligence Without Sim-to-Real,"Abstract This article introduces in-situ learning (ISL), a paradigm in which drones adapt directly through real-world interaction rather than relying on simulation-to-reality (sim-to-real) transfer. Whereas sim-to-real separates training from embodiment, ISL integrates the physical interaction features into the learning loop, treating disturbances such as wind gusts, ground effect, and collisions not as nuisances but as informative signals. We formulate the in-situ learning problem for quadrotor UAVs and develop an adaptive reservoir critic with continuous-time weight updates. The framework admits formal guarantees of boundedness, convergence, and input-to-state stability, and introduces interaction-gated adaptation , where natural disturbances provide the persistent excitation required for learning. Experimental studies via both simulations and a real-world quadrotor demonstrate emergen",2026,IOP Conference Series: Materials Science and Engineering,Anthony Siming Chen; Sophia Shuhui Meng; Zhongmou Li,10.1088/1757-899x/1343/1/012015,,https://doi.org/10.1088/1757-899x/1343/1/012015,crossref,sim to real robot manipulation,concept,sim2real,,,robot manipulation; sim to real transfer; benchmark; robustness,2026-06-12T15:07:36Z,25.350,29.350
doi:10.1007/s11633-025-1566-0,Online Iterative Learning Enhanced Sim-to-Real Transfer for Efficient Manipulation of Deformable Objects,"Abstract Deformable manipulation has attracted a lot of attention in the field of robotics, especially in medical applications. However, manipulating deformable objects faces various challenges, mainly including their complex dynamic properties and unpredictable nonlinear deformations. It is difficult to provide a basis for deformable object measurements without effective control methods that provide intelligent and accurate position control, and this research also provides a premise for deformable object measurements. To address these issues, this paper proposes an online iterative perception policy (IPP) method, which does not require large-scale deep network training. This method is able to perceive transformations through an iterative process, and achieve efficient and accurate control of deformable objects. Extensive experiments in the simulation environment and the real scene are c",2025,Machine Intelligence Research,Zuyan Chen; Jian-An Huang; Juha Röning; Leopoldo Angrisani; Shuai Li,10.1007/s11633-025-1566-0,,https://doi.org/10.1007/s11633-025-1566-0,crossref,sim to real robot manipulation,concept,sim2real,,,robot manipulation; sim to real transfer; model predictive control; robustness,2026-06-12T14:45:03Z,26.300,29.300
arxiv:2605.05241v1,DexSim2Real: Foundation Model-Guided Sim-to-Real Transfer for Generalizable Dexterous Manipulation,"Sim-to-real transfer remains a critical bottleneck for deploying dexterous manipulation policies learned in simulation to real-world robots. Existing approaches rely on manually designed domain randomization or task-specific adaptation, limiting their generalizability across diverse manipulation scenarios. We present DexSim2Real, an integrated framework that leverages vision-language foundation models to bridge the sim-to-real gap for dexterous manipulation. Our system combines three components: (1) Foundation Model-Guided Domain Randomization (FM-DR), which uses a vision-language model as a visual realism critic to optimize simulation parameters via closed-loop CMA-ES, complementing text-based approaches like DrEureka with direct visual feedback; (2) a Tactile-Visual Cross-Attention Policy (TVCAP) that adapts cross-attention visuo-tactile fusion to zero-shot sim-to-real RL; and (3) a Pr",2026,arXiv,Zijian Zeng; Fei Ding; Huiming Yang; Xianwei Li; Yuhao Liao,,2605.05241v1,http://arxiv.org/abs/2605.05241v1,arxiv,sim to real robot manipulation,concept,sim2real,,,robot manipulation; dexterous manipulation; sim to real transfer; domain randomization,2026-06-12T14:45:03Z,27.200,29.200
arxiv:2509.25747v1,Best of Sim and Real: Decoupled Visuomotor Manipulation via Learning Control in Simulation and Perception in Real,"Sim-to-real transfer remains a fundamental challenge in robot manipulation due to the entanglement of perception and control in end-to-end learning. We present a decoupled framework that learns each component where it is most reliable: control policies are trained in simulation with privileged state to master spatial layouts and manipulation dynamics, while perception is adapted only at deployment to bridge real observations to the frozen control policy. Our key insight is that control strategies and action patterns are universal across environments and can be learned in simulation through systematic randomization, while perception is inherently domain-specific and must be learned where visual observations are authentic. Unlike existing end-to-end approaches that require extensive real-world data, our method achieves strong performance with only 10-20 real demonstrations by reducing the ",2025,arXiv,Jialei Huang; Zhaoheng Yin; Yingdong Hu; Shuo Wang; Xingyu Lin; Yang Gao,,2509.25747v1,http://arxiv.org/abs/2509.25747v1,arxiv,sim to real robot manipulation,concept,sim2real,,,robot manipulation; sim to real transfer; generalization; out of distribution; data efficiency; deployment,2026-06-12T14:45:03Z,24.200,29.200
doi:10.48550/arxiv.2010.04296,CausalWorld: A Robotic Manipulation Benchmark for Causal Structure and Transfer Learning,"Despite recent successes of reinforcement learning (RL), it remains a challenge for agents to transfer learned skills to related environments. To facilitate research addressing this problem, we propose CausalWorld, a benchmark for causal structure and transfer learning in a robotic manipulation environment. The environment is a simulation of an open-source robotic platform, hence offering the possibility of sim-to-real transfer. Tasks consist of constructing 3D shapes from a given set of blocks - inspired by how children learn to build complex structures. The key strength of CausalWorld is that it provides a combinatorial family of such tasks with common causal structure and underlying factors (including, e.g., robot and object masses, colors, sizes). The user (or the agent) may intervene on all causal variables, which allows for fine-grained control over how similar different tasks (or ",2020,arXiv (Cornell University),Ossama Ahmed; Frederik Träuble; Anirudh Goyal; Alexander Neitz; Yoshua Bengio; Bernhard Schölkopf; Manuel Wüthrich; Stefan Bauer,10.48550/arxiv.2010.04296,,https://doi.org/10.48550/arxiv.2010.04296,openalex,robotics,concept,openalex_bulk_robotics,,31,sim to real transfer; benchmark; generalization; long horizon,2026-06-12T18:57:17Z,25.133,29.133
doi:10.2514/6.2025-1343,Improving Sim-to-Real Transfer in Vision-Based Robot Navigation via Instance-Level GAN-Based Data Augmentation,,2025,AIAA SCITECH 2025 Forum,Ignacio G. Lopez-Francos; Rory Lipkis; Pavlo G. Vlastos; Adrian Agogino,10.2514/6.2025-1343,,https://doi.org/10.2514/6.2025-1343,crossref,sim to real robot manipulation,concept,sim2real,,1,robot manipulation; sim to real transfer,2026-06-12T14:45:03Z,27.947,28.947
doi:10.30857/2786-5371.2025.5.5,REINFORCEMENT LEARNING FOR AUTONOMOUS NAVIGATION OF ROBOTIC PLATFORMS UNDER UNCERTAINTY: DOMAIN RANDOMIZATION AND SIM-TO-REAL TRANSFER,"Purpose. To develop and experimentally evaluate the effectiveness of an autonomous navigation system for a four-wheeled mobile robotic platform based on the Proximal Policy Optimization (PPO) algorithm with subsequent deployment of the model on an ESP32 microcontroller and ensuring reliable Sim-to-Real transfer in an uncertain and dynamic environment. Methodology. The study applied a deep reinforcement learning approach using the PPO algorithm. A comparative analysis was conducted with the TD3, SAC, DDPG, A2C, Bug Algorithm, and Random Policy algorithms. The evaluation was carried out according to the following indicators: goal achievement success, collision frequency, trajectory efficiency, and learning stability (average reward and standard deviation). To bridge the gap between simulation and reality, the Domain Randomization method was used with variations in six physical parameters: ",2025,Technologies and Engineering,Vladyslav PYLYPENKO; Vladyslava SKIDAN; Antonina VOLIVACH; Olena MYTELSKA; Vadym AFTANDILYANTS,10.30857/2786-5371.2025.5.5,,https://doi.org/10.30857/2786-5371.2025.5.5,crossref,sim to real robot manipulation,concept,sim2real,,,robot manipulation; sim to real transfer; domain randomization; generalization; deployment,2026-06-12T15:07:36Z,23.650,28.650
