uid,title,abstract,year,venue,authors,doi,arxiv_id,url,source,query,query_role,family,advisor_seed,citation_count,matched_terms,retrieved_at,relevance_score,hostile_score
doi:10.36227/techrxiv.174702494.40001036/v1,ADR-PNAS: a Novel Sim-to-Real Transfer Approach for Robotic Manipulation Tasks,"Sim-to-real transfer in robotic manipulation tasks has emerged as a crucial area of research, addressing the challenge of bridging the gap between simulated environments and real-world applications. This paper presents a brief review of current methodologies and introduces novel approaches to enhance the efficacy of sim-to-real transfer. We propose a new framework, Adaptive Domain Randomization with Progressive Neural Architecture Search (ADR-PNAS), which combines adaptive domain randomization techniques with neural architecture search to optimize both the simulation parameters and the neural network architecture for improved transfer. We evaluate our approach against multiple state-of-the-art baselines, including Standard Domain Randomization (DR), Adaptive Domain Randomization (ADR), Model-Agnostic Meta-Learning (MAML), Randomized-to-Canonical Adaptation Networks (RCAN), and Ensemble P",,,Yu Nong; Hai-Tao Zhang; Jia-Qiang Sun,10.36227/techrxiv.174702494.40001036/v1,,https://doi.org/10.36227/techrxiv.174702494.40001036/v1,crossref,sim to real robot manipulation,concept,sim2real,,,robot manipulation; sim to real transfer; domain randomization,2026-06-12T14:45:03Z,25.000,27.000
doi:10.3390/jmse10070895,Sim-to-Real: Mapless Navigation for USVs Using Deep Reinforcement Learning,"In recent years, mapless navigation using deep reinforcement learning algorithms has shown significant advantages in improving robot motion planning capabilities. However, the majority of past works have focused on aerial and ground robotics, with very little attention being paid to unmanned surface vehicle (USV) navigation and ultimate deployment on real platforms. In response, this paper proposes a mapless navigation method based on deep reinforcement learning for USVs. Specifically, we carefully design the observation space, action space, reward function, and neural network for a navigation policy that allows the USV to reach the destination collision-free when equipped with only local sensors. Aiming at the sim-to-real transfer and slow convergence of deep reinforcement learning, this paper proposes a dynamics-free training and consistency strategy and designs domain randomization an",2022,Journal of Marine Science and Engineering,Ning Wang; Yabiao Wang; Yuming Zhao; Yong Wang; Zhigang Li,10.3390/jmse10070895,,https://doi.org/10.3390/jmse10070895,crossref,sim to real robot manipulation,concept,sim2real,,22,robot manipulation; sim to real transfer; domain randomization; motion planning; deployment,2026-06-12T15:07:36Z,23.968,26.968
doi:10.1109/saci66288.2025.11030154,Online Iterative Learning Enhanced Sim-to-Real Transfer for Efficient Manipulation of Deformable Objects,,2025,2025 IEEE 19th International Symposium on Applied Computational Intelligence and Informatics (SACI),Shuai Li,10.1109/saci66288.2025.11030154,,https://doi.org/10.1109/saci66288.2025.11030154,crossref,sim to real robot manipulation,concept,sim2real,,1,robot manipulation; sim to real transfer,2026-06-12T14:45:03Z,25.947,26.947
arxiv:2511.06465v1,Sim-to-Real Transfer in Deep Reinforcement Learning for Bipedal Locomotion,"This chapter addresses the critical challenge of simulation-to-reality (sim-to-real) transfer for deep reinforcement learning (DRL) in bipedal locomotion. After contextualizing the problem within various control architectures, we dissect the ``curse of simulation'' by analyzing the primary sources of sim-to-real gap: robot dynamics, contact modeling, state estimation, and numerical solvers. Building on this diagnosis, we structure the solutions around two complementary philosophies. The first is to shrink the gap through model-centric strategies that systematically improve the simulator's physical fidelity. The second is to harden the policy, a complementary approach that uses in-simulation robustness training and post-deployment adaptation to make the policy inherently resilient to model inaccuracies. The chapter concludes by synthesizing these philosophies into a strategic framework, p",2025,arXiv,Lingfan Bao; Tianhu Peng; Chengxu Zhou,,2511.06465v1,http://arxiv.org/abs/2511.06465v1,arxiv,sim to real robot manipulation,concept,sim2real,,,robot manipulation; sim to real transfer; state estimation; robustness; deployment,2026-06-12T14:45:03Z,23.850,26.850
arxiv:2502.08645v3,Re$^3$Sim: Generating High-Fidelity Simulation Data via 3D-Photorealistic Real-to-Sim for Robotic Manipulation,"Real-world data collection for robotics is costly and resource-intensive, requiring skilled operators and expensive hardware. Simulations offer a scalable alternative but often fail to achieve sim-to-real generalization due to geometric and visual gaps. To address these challenges, we propose a 3D-photorealistic real-to-sim system, namely, RE$^3$SIM, addressing geometric and visual sim-to-real gaps. RE$^3$SIM employs advanced 3D reconstruction and neural rendering techniques to faithfully recreate real-world scenarios, enabling real-time rendering of simulated cross-view cameras within a physics-based simulator. By utilizing privileged information to collect expert demonstrations efficiently in simulation, and train robot policies with imitation learning, we validate the effectiveness of the real-to-sim-to-real pipeline across various manipulation task scenarios. Notably, with only simul",2025,arXiv,Xiaoshen Han; Minghuan Liu; Yilun Chen; Junqiu Yu; Xiaoyang Lyu; Yang Tian; Bolun Wang; Weinan Zhang; Jiangmiao Pang,,2502.08645v3,http://arxiv.org/abs/2502.08645v3,arxiv,sim to real robot manipulation,concept,sim2real,,,robot manipulation; sim to real transfer; imitation learning; generalization,2026-06-12T14:45:03Z,23.850,26.850
arxiv:2605.26638v1,HyperSim: A Holistic Sim-To-Real Framework For Robust Robotic Manipulation,"Scaling data volume and diversity is critical for generalizing embodied intelligence. While synthetic data generation offers a scalable alternative to expensive physical data acquisition, transferring robotic manipulation policies from simulation to the real world (sim-to-real) remains a formidable challenge due to the domain gap. This paper presents HyperSim, a holistic framework spanning from synthetic data generation to policy training and seamless real-world deployment. To systematically bridge the sim-to-real gap, HyperSim is realized through three core pillars: high-fidelity environment synthesis, adversarial trajectory generation, and sim-and-real co-training. Collectively, these modules address domain discrepancies by enhancing visual fidelity, expanding data coverage, and enforcing domain-invariant representations. We rigorously validate HyperSim through a large-scale empirical ",2026,arXiv,Junyi Dong; Haotian Luo; Ziwei Xu; Shengwei Bian; Heng Zhang; Sitong Mao; Jingyi Guo; Yang Xu; Wenhao Chen; Qiuyu Feng; Yao Mu; Ping Luo; Shunbo Zhou; Xiaodong Wu,,2605.26638v1,http://arxiv.org/abs/2605.26638v1,arxiv,sim to real robot manipulation,concept,sim2real,,,robot manipulation; robustness; deployment,2026-06-12T14:45:03Z,21.850,26.850
arxiv:2511.15200v2,VIRAL: Visual Sim-to-Real at Scale for Humanoid Loco-Manipulation,"A key barrier to the real-world deployment of humanoid robots is the lack of autonomous loco-manipulation skills. We introduce VIRAL, a visual sim-to-real framework that learns humanoid loco-manipulation entirely in simulation and deploys it zero-shot to real hardware. VIRAL follows a teacher-student design: a privileged RL teacher, operating on full state, learns long-horizon loco-manipulation using a delta action space and reference state initialization. A vision-based student policy is then distilled from the teacher via large-scale simulation with tiled rendering, trained with a mixture of online DAgger and behavior cloning. We find that compute scale is critical: scaling simulation to tens of GPUs (up to 64) makes both teacher and student training reliable, while low-compute regimes often fail. To bridge the sim-to-real gap, VIRAL combines large-scale visual domain randomization ove",2025,arXiv,Tairan He; Zi Wang; Haoru Xue; Qingwei Ben; Zhengyi Luo; Wenli Xiao; Ye Yuan; Xingye Da; Fernando Castañeda; Shankar Sastry; Changliu Liu; Guanya Shi; Linxi Fan; Yuke Zhu,,2511.15200v2,http://arxiv.org/abs/2511.15200v2,arxiv,sim to real robot manipulation,concept,sim2real,,,robot manipulation; humanoid robot; domain randomization; behavior cloning; teleoperation; ablation; deployment; long horizon,2026-06-12T14:45:03Z,21.850,26.850
doi:10.1109/iros58592.2024.10801397,Fine Manipulation Using a Tactile Skin: Learning in Simulation and Sim-to-Real Transfer,,2024,2024 IEEE/RSJ International Conference on Intelligent Robots and Systems (IROS),Ulf Kasolowsky; Berthold Bäuml,10.1109/iros58592.2024.10801397,,https://doi.org/10.1109/iros58592.2024.10801397,crossref,sim to real robot manipulation,concept,sim2real,,1,robot manipulation; sim to real transfer,2026-06-12T14:45:03Z,25.747,26.747
doi:10.1002/advs.202308881,Learning Soft Millirobot Multimodal Locomotion with Sim‐to‐Real Transfer,"Abstract With wireless multimodal locomotion capabilities, magnetic soft millirobots have emerged as potential minimally invasive medical robotic platforms. Due to their diverse shape programming capability, they can generate various locomotion modes, and their locomotion can be adapted to different environments by controlling the external magnetic field signal. Existing adaptation methods, however, are based on hand‐tuned signals. Here, a learning‐based adaptive magnetic soft millirobot multimodal locomotion framework empowered by sim‐to‐real transfer is presented. Developing a data‐driven magnetic soft millirobot simulation environment, the periodic magnetic actuation signal is learned for a given soft millirobot in simulation. Then, the learned locomotion strategy is deployed to the real world using Bayesian optimization and Gaussian processes. Finally, automated domain recognition an",2024,Advanced Science,Sinan Ozgun Demir; Mehmet Efe Tiryaki; Alp Can Karacakol; Metin Sitti,10.1002/advs.202308881,,https://doi.org/10.1002/advs.202308881,crossref,sim to real robot manipulation,concept,sim2real,,11,robot manipulation; sim to real transfer,2026-06-12T15:07:36Z,24.692,26.692
doi:10.3390/app16104584,Assessing Stand-to-Sit Kinematics via mmWave Radar: A Real-to-Sim Robust Bidirectional State-Space Model,"Continuous monitoring of the Stand-to-Sit (STS) transition serves as a critical indicator of lower-limb frailty in the elderly, for which millimeter-wave radar provides an ideal privacy-preserving, device-free sensing solution. However, robustly distinguishing between safe Controlled Sits (CSs) and dangerous Uncontrolled Descents (UDs) is severely hindered by the prohibitive cost of subjective expert scoring for fine-grained labels, alongside the pervasive “Clever Hans” effect where existing deep models overfit static environmental clutter rather than learning intrinsic human kinematics. To circumvent these bottlenecks, we formulate STS evaluation as a dynamic boundary detection problem and propose SCA-BiMamba, a linear-complexity bidirectional State-Space Model that utilizes actual fall events as extreme kinematic surrogates for UDs. This forces the network to learn a strict physical bo",2026,Applied Sciences,Yancheng Liu; Yan Fu; Le Chang; Zhengke Gao; Alex Mihailidis,10.3390/app16104584,,https://doi.org/10.3390/app16104584,crossref,sim to real robot manipulation,concept,sim2real,,,robot manipulation; shortcut learning,2026-06-12T15:07:36Z,24.650,26.650
doi:10.1145/3736419,Sim-to-Real Transfer for Estimation over Wireless Networks,"Data-driven models for state estimation using measurements obtained over a wireless network are essential to cyber-physical systems. Learning a data-driven model for an estimator using real wireless network deployments is, however, impractical as it would require data that captures varied wireless network conditions and their impact on estimation. We propose and evaluate a simulation to real-world transfer of a data-driven model for state estimation. Specifically, we train an estimator model using only data generated by a low-fidelity simulation of networks. Our choice of network simulation is a first-come-first-served single server queue, which is a network model with the two parameters of arrival rate of measurement packets into the queue and packet service rates. We employ domain randomization to bridge the gap between simulation and the real world, appropriately randomizing the netwo",2025,ACM Transactions on Cyber-Physical Systems,Shivangi Agarwal; Adi Asija; Sanjit K. Kaul; Saket Anand,10.1145/3736419,,https://doi.org/10.1145/3736419,crossref,sim to real robot manipulation,concept,sim2real,,1,robot manipulation; sim to real transfer; domain randomization; state estimation; deployment,2026-06-12T15:07:36Z,23.647,26.647
doi:10.1109/tro.2025.3644950,ADR-PNAS: A Novel Sim-to-Real Transfer Approach for Robotic Manipulation Tasks,,2026,IEEE Transactions on Robotics,Yu Nong,10.1109/tro.2025.3644950,,https://doi.org/10.1109/tro.2025.3644950,crossref,sim to real robot manipulation,concept,sim2real,,,robot manipulation; sim to real transfer,2026-06-12T14:45:03Z,25.600,26.600
doi:10.1299/jsmermd.2025.1p1-e03,Design of a Parallel Wire-Driven One-Legged Hopping Robot RAMIEL2 for Sim-to-Real Transfer in Reinforcement Learning 強化学習におけるsim2realに向けたパラレルワイヤ駆動一本脚跳躍ロボットRAMIEL2の設計,,2025,The Proceedings of JSME annual Conference on Robotics and Mechatronics (Robomec),Temma SUZUKI; Kento KAWAHARAZUKA; Kei OKADA,10.1299/jsmermd.2025.1p1-e03,,https://doi.org/10.1299/jsmermd.2025.1p1-e03,crossref,sim to real robot manipulation,concept,sim2real,,,robot manipulation; sim to real transfer,2026-06-12T15:07:36Z,25.600,26.600
doi:10.1109/icra55743.2025.11128837,Robotic Sim-to-Real Transfer for Long-Horizon Pick-and-Place Tasks in the Robotic Sim2Real Competition,,2025,2025 IEEE International Conference on Robotics and Automation (ICRA),Ming Yang; Hongyu Cao; Lixuan Zhao; Chenrui Zhang; Yaran Chen,10.1109/icra55743.2025.11128837,,https://doi.org/10.1109/icra55743.2025.11128837,crossref,sim to real robot manipulation,concept,sim2real,,,robot manipulation; sim to real transfer; long horizon,2026-06-12T15:07:36Z,25.600,26.600
doi:10.1007/s10994-021-05982-z,Grounded action transformation for sim-to-real reinforcement learning,"Abstract Reinforcement learning in simulation is a promising alternative to the prohibitive sample cost of reinforcement learning in the physical world. Unfortunately, policies learned in simulation often perform worse than hand-coded policies when applied on the target, physical system. Grounded simulation learning ( gsl ) is a general framework that promises to address this issue by altering the simulator to better match the real world (Farchy et al. 2013 in Proceedings of the 12th international conference on autonomous agents and multiagent systems (AAMAS)). This article introduces a new algorithm for gsl —Grounded Action Transformation (GAT)—and applies it to learning control policies for a humanoid robot. We evaluate our algorithm in controlled experiments where we show it to allow policies learned in simulation to transfer to the real world. We then apply our algorithm to learning ",2021,Machine Learning,Josiah P. Hanna; Siddharth Desai; Haresh Karnan; Garrett Warnell; Peter Stone,10.1007/s10994-021-05982-z,,https://doi.org/10.1007/s10994-021-05982-z,crossref,sim to real robot manipulation,concept,sim2real,,25,robot manipulation; humanoid robot; limitation,2026-06-12T15:07:36Z,23.479,26.479
doi:10.1609/aaai.v38i1.27758,Prompt to Transfer: Sim-to-Real Transfer for Traffic Signal Control with Prompt Learning,"Numerous solutions are proposed for the Traffic Signal Control (TSC) tasks aiming to provide efficient transportation and alleviate traffic congestion. Recently, promising results have been attained by Reinforcement Learning (RL) methods through trial and error in simulators, bringing confidence in solving cities' congestion problems. However, performance gaps still exist when simulator-trained policies are deployed to the real world. This issue is mainly introduced by the system dynamic difference between the training simulators and the real-world environments. In this work, we leverage the knowledge of Large Language Models (LLMs) to understand and profile the system dynamics by a prompt-based grounded action transformation to bridge the performance gap. Specifically, this paper exploits the pre-trained LLM's inference ability to understand how traffic dynamics change with weather cond",2024,Proceedings of the AAAI Conference on Artificial Intelligence,Longchao Da; Minquan Gao; Hao Mei; Hua Wei,10.1609/aaai.v38i1.27758,,https://doi.org/10.1609/aaai.v38i1.27758,crossref,sim to real robot manipulation,concept,sim2real,,30,robot manipulation; sim to real transfer,2026-06-12T15:07:36Z,24.467,26.467
doi:10.1109/iccma63715.2024.10843928,Sim-to-Real Transfer for Cable Manipulation with Tactile Sensing and Homotopy-Constrained Path Planning,,2024,"2024 12th International Conference on Control, Mechatronics and Automation (ICCMA)",Haegu Lee; Victor Melbye Staven; Christoffer Sloth,10.1109/iccma63715.2024.10843928,,https://doi.org/10.1109/iccma63715.2024.10843928,crossref,sim to real robot manipulation,concept,sim2real,,,robot manipulation; sim to real transfer,2026-06-12T14:45:03Z,25.400,26.400
arxiv:2103.16772v2,Causal Reasoning in Simulation for Structure and Transfer Learning of Robot Manipulation Policies,"We present CREST, an approach for causal reasoning in simulation to learn the relevant state space for a robot manipulation policy. Our approach conducts interventions using internal models, which are simulations with approximate dynamics and simplified assumptions. These interventions elicit the structure between the state and action spaces, enabling construction of neural network policies with only relevant states as input. These policies are pretrained using the internal model with domain randomization over the relevant states. The policy network weights are then transferred to the target domain (e.g., the real world) for fine tuning. We perform extensive policy transfer experiments in simulation for two representative manipulation tasks: block stacking and crate opening. Our policies are shown to be more robust to domain shifts, more sample efficient to learn, and scale to more compl",2021,arXiv,Tabitha Edith Lee; Jialiang Zhao; Amrita S. Sawhney; Siddharth Girdhar; Oliver Kroemer,,2103.16772v2,http://arxiv.org/abs/2103.16772v2,arxiv,diffusion policy robot manipulation,concept,diffusion,,,diffusion policy; robot manipulation; sim to real transfer; domain randomization,2026-06-12T14:45:03Z,23.400,26.400
doi:10.1155/2020/8015979,Coordinating Manipulation in Real-time Interactive Mechanism of College Admission: Agent-Based Simulations,"The matching in college admission is a typical example of applying algorithms in cyberspace to improve the efficiency of the corresponding process in physical space. This paper studies the real-time interactive mechanism (RIM) recently adopted in Inner Mongolia of China, where students can immediately observe the provisional admission results for their applications and are allowed to modify the application before the deadline. Since the universities accept the applications according to the ranking of the scores, RIM is believed to make the competition more transparent. However, students may coordinate to manipulate this mechanism. A high-score student can perform a last-minute change on the university applied, opening a slot for a student with a much lower score. With agent-based simulations, we find that a large portion of students will choose to perform coordinating manipulation, which",2020,Complexity,Lan Hou; Tao Jia; Xiangbing Wang; Tongkui Yu,10.1155/2020/8015979,,https://doi.org/10.1155/2020/8015979,crossref,sim to real robot manipulation,concept,sim2real,,1,robot manipulation,2026-06-12T15:07:36Z,25.347,26.347
doi:10.2139/ssrn.6256108,Robust Zero-Shot Sim-to-Real Transfer in Agri-CPS: A Digital Twin Framework with Volumetric Overlap Feedback,"In in-row navigation scenarios typified by dense broccoli crops, Agricultural Cyber-Physical Systems (Agri-CPS) face integration failures due to visual occlusion and dynamic illumination. Existing methods relying on manual annotation also incur high deployment costs. To address these challenges, this paper proposes a Digital Twin-driven Physical-Virtual Integration Framework for robust zero-shot autonomous navigation. The framework utilizes UAV photogrammetry to construct high-fidelity digital twin assets. An end-to-end Deep Reinforcement Learning (DRL) agent is then trained within this environment using only depth inputs. A novel ""Volumetric Overlap"" mechanism calculates real-time geometric interference, converting it into a dense reward signal without manual annotation to guide low-damage policy evolution. Finally, the trained policy is directly deployed to physical robots. Validation ",,,Jiali Fan; Jun Wang; Dongfang Li; Shuo Kang; Sifang Long; Yiting Chen; Xuanhe Fu; Chengzhong Pan; Yizhou Li; Fuxin Ye,10.2139/ssrn.6256108,,https://doi.org/10.2139/ssrn.6256108,crossref,sim to real robot manipulation,concept,sim2real,,,robot manipulation; sim to real transfer; occlusion; deployment,2026-06-12T15:07:36Z,23.300,26.300
doi:10.3389/frobt.2022.1067502,Sim-to-real via latent prediction: Transferring visual non-prehensile manipulation policies,"Reinforcement Learning has been shown to have a great potential for robotics. It demonstrated the capability to solve complex manipulation and locomotion tasks, even by learning end-to-end policies that operate directly on visual input, removing the need for custom perception systems. However, for practical robotics applications, its scarce sample efficiency, the need for huge amounts of resources, data, and computation time can be an insurmountable obstacle. One potential solution to this sample efficiency issue is the use of simulated environments. However, the discrepancy in visual and physical characteristics between reality and simulation, namely the sim-to-real gap, often significantly reduces the real-world performance of policies trained within a simulator. In this work we propose a sim-to-real technique that trains a Soft-Actor Critic agent together with a decoupled feature extr",2023,Frontiers in Robotics and AI,Carlo Rizzardo; Fei Chen; Darwin Caldwell,10.3389/frobt.2022.1067502,,https://doi.org/10.3389/frobt.2022.1067502,crossref,sim to real robot manipulation,concept,sim2real,,6,robot manipulation; sim to real transfer; sample efficiency,2026-06-12T14:45:03Z,24.223,26.223
doi:10.1177/0278364919870227,Adversarial discriminative sim-to-real transfer of visuo-motor policies,"Various approaches have been proposed to learn visuo-motor policies for real-world robotic applications. One solution is first learning in simulation then transferring to the real world. In the transfer, most existing approaches need real-world images with labels. However, the labeling process is often expensive or even impractical in many robotic applications. In this article, we introduce an adversarial discriminative sim-to-real transfer approach to reduce the amount of labeled real data required. The effectiveness of the approach is demonstrated with modular networks in a table-top object-reaching task where a seven-degree-of-freedom arm is controlled in velocity mode to reach a blue cuboid in clutter through visual observations from a monocular RGB camera. The adversarial transfer approach reduced the labeled real data requirement by 50%. Policies can be transferred to real environm",2019,The International Journal of Robotics Research,Fangyi Zhang; Jürgen Leitner; Zongyuan Ge; Michael Milford; Peter Corke,10.1177/0278364919870227,,https://doi.org/10.1177/0278364919870227,crossref,sim to real robot manipulation,concept,sim2real,,33,robot manipulation; sim to real transfer,2026-06-12T15:07:36Z,24.213,26.213
arxiv:2004.00136v1,Sim-to-Real Transfer for Optical Tactile Sensing,"Deep learning and reinforcement learning methods have been shown to enable learning of flexible and complex robot controllers. However, the reliance on large amounts of training data often requires data collection to be carried out in simulation, with a number of sim-to-real transfer methods being developed in recent years. In this paper, we study these techniques for tactile sensing using the TacTip optical tactile sensor, which consists of a deformable tip with a camera observing the positions of pins inside this tip. We designed a model for soft body simulation which was implemented using the Unity physics engine, and trained a neural network to predict the locations and angles of edges when in contact with the sensor. Using domain randomisation techniques for sim-to-real transfer, we show how this framework can be used to accurately predict edges with less than 1 mm prediction error ",2020,arXiv,Zihan Ding; Nathan F. Lepora; Edward Johns,,2004.00136v1,http://arxiv.org/abs/2004.00136v1,arxiv,sim to real robot manipulation,concept,sim2real,,,robot manipulation; sim to real transfer,2026-06-12T14:45:03Z,25.200,26.200
